{
  "version": "POC-1",
  "network": "solana",
  "cluster": "devnet",
  "programId": "AeKT1B58Qi9rBtrtnMe11o4eXbVwHweKxGFNS5X3Vv46",
  "campaign": "NW4DiF2wYuvS1ygqbsnhontvW8q8xCz1KMZrvizcHRD",
  "merchant": "9sZf5DejzB59rt4Lx9eYs9F7o9CwhyCRXrD1pbTHjsj8",
  "terminalDevice": "GNiPZveah8Hs4YP1fyMmNpkFPrjTudkGUDE7LvrKJLtn",
  "terminalAuthority": "CA1VxbkBxDri5ZH2zeALU7MWajpEojuTHoFKu5mEqhAH",
  "visitorAuthority": "DEmjrDq3kKLsHnWCX1Qc3ubSmBdx4iLA7iWcoM1dPosT",
  "claimPass": "3eMK2ET3KpgKvqQ78PJUhKVX75Bs36G1uptsCxThujXK",
  "receipt": "Hvaos2q61tnsJ43EdyCGpskhgZ3ZbzhmQWWvcgt9JkYi",
  "nullifier": "276yEybe1QYVFyuA5jsR4NsCMsQxkqzAJAudHBKvY6VE",
  "settlement": "CcgGjXbaiqUZ4TNFfTm8rAZkLhUc4ZPNZBDvZumQaLMM",
  "intentManifestHash": "cf4e2dbd135da76d26331f494d9bd94277e70c5fddd1af7460541888a4751303",
  "visitAttestationHash": "f096dafaf241d6827f7b02159c65fc292a9f7c921eb40774078670ed4959ab8a",
  "lineageProofHash": "d79583770817bc630636cb4c382f7edd26110d656803ec56c09704727bf48062",
  "rewardMint": "BVHSc6ao6LYovLWKAQnbzbikE8ygiWWZqrMUmqDeg9No",
  "rewardAmount": "1000",
  "proofLevel": "merchant_terminal_visitor_signed",
  "terminalVerified": true,
  "visitorVerified": true,
  "lineageVerified": true,
  "settlementVerified": true,
  "nullifierVerified": true
}
